{
  "arm": "B_note",
  "mode": "full-local",
  "family": "demo_family",
  "package_type": "demo_package",
  "workload_scale": 8,
  "n": 8,
  "R_hor": 8,
  "R_car": 8,
  "k_min": 17,
  "k_run": 17,
  "logical_lookup_cells": 2272,
  "logical_mul_constraints": 864,
  "logical_lin_constraints": 1168,
  "physical_rows": 232,
  "advice_cols": 19,
  "fixed_cols": 9,
  "instance_cols": 0,
  "synth_ms": 0.0012,
  "keygen_vk_ms": 279.2809,
  "keygen_pk_ms": 993.9362000000001,
  "prove_ms": 12637.5358,
  "verify_ms": 5.1782,
  "peak_rss_mb": 901.77734375,
  "proof_bytes": 5088,
  "commit_hash": "2763823aedacf52b7541e23d498f2d74c196f602",
  "rust_version": "rustc 1.89.0 (29483883e 2025-08-04)",
  "backend_commit": "2763823aedacf52b7541e23d498f2d74c196f602",
  "machine_profile": "os=Windows;release=10;arch=AMD64;cpu=Intel64 Family 6 Model 151 Stepping 2, GenuineIntel;logical_cpu=12;physical_cpu=6;ram_gb=15.8",
  "status": "full-local-ok",
  "notes": "B_note full-local measured with real keygen/prove/verify (Blake2b transcript); input_profile=standard; release-build runner; k_min probed in a separate untimed pass"
}