{
  "arm": "A_secure",
  "mode": "full-local",
  "family": "demo_family",
  "package_type": "demo_package",
  "workload_scale": 32,
  "n": 32,
  "R_hor": 32,
  "R_car": 32,
  "k_min": 10,
  "k_run": 13,
  "logical_lookup_cells": 0,
  "logical_mul_constraints": 145920,
  "logical_lin_constraints": 4672,
  "physical_rows": 928,
  "advice_cols": 167,
  "fixed_cols": 6,
  "instance_cols": 0,
  "synth_ms": 0.0014,
  "keygen_vk_ms": 0,
  "keygen_pk_ms": 0,
  "prove_ms": 318.238,
  "verify_ms": 188.429,
  "peak_rss_mb": 71.28515625,
  "proof_bytes": 0,
  "commit_hash": "unknown",
  "rust_version": "rustc 1.89.0 (29483883e 2025-08-04)",
  "backend_commit": "unknown",
  "machine_profile": "Windows-AMD64",
  "status": "full-local-ok",
  "notes": "A_secure full-local (row-family equivalent) measured with explicit bit decomposition"
}