{
  "arm": "B_note",
  "mode": "full-local",
  "family": "demo_family",
  "package_type": "demo_package",
  "workload_scale": 208,
  "n": 208,
  "R_hor": 208,
  "R_car": 208,
  "k_min": 13,
  "k_run": 13,
  "logical_lookup_cells": 59072,
  "logical_mul_constraints": 22464,
  "logical_lin_constraints": 30368,
  "physical_rows": 6032,
  "advice_cols": 19,
  "fixed_cols": 9,
  "instance_cols": 0,
  "synth_ms": 0.0012,
  "keygen_vk_ms": 943.1372,
  "keygen_pk_ms": 951.3891,
  "prove_ms": 8954.3038,
  "verify_ms": 25.9854,
  "peak_rss_mb": 69.46484375,
  "proof_bytes": 5088,
  "commit_hash": "unknown",
  "rust_version": "rustc 1.89.0 (29483883e 2025-08-04)",
  "backend_commit": "unknown",
  "machine_profile": "Windows-AMD64",
  "status": "full-local-ok",
  "notes": "B_note full-local measured with real keygen/prove/verify (Blake2b transcript)"
}