{
  "arm": "A_secure",
  "mode": "full-local",
  "family": "demo_family",
  "package_type": "demo_package",
  "workload_scale": 4520,
  "n": 4520,
  "R_hor": 4520,
  "R_car": 4520,
  "k_min": 18,
  "k_run": 18,
  "logical_lookup_cells": 0,
  "logical_mul_constraints": 20611200,
  "logical_lin_constraints": 659920,
  "physical_rows": 131080,
  "advice_cols": 167,
  "fixed_cols": 6,
  "instance_cols": 0,
  "synth_ms": 9.999999999999999e-05,
  "keygen_vk_ms": 1604.4498,
  "keygen_pk_ms": 2286.8569,
  "prove_ms": 32075.518000000004,
  "verify_ms": 6.7088,
  "peak_rss_mb": 6296.2421875,
  "proof_bytes": 11072,
  "commit_hash": "2f9b4bb1aafc53ad00fb5feef457ea5189a771ab",
  "rust_version": "rustc 1.89.0 (29483883e 2025-08-04)",
  "backend_commit": "2f9b4bb1aafc53ad00fb5feef457ea5189a771ab",
  "machine_profile": "os=Windows;release=10;arch=AMD64;cpu=Intel64 Family 6 Model 151 Stepping 2, GenuineIntel;logical_cpu=12;physical_cpu=6;ram_gb=15.8",
  "status": "full-local-ok",
  "notes": "A_secure full-local measured with real keygen/prove/verify (Blake2b transcript); input_profile=boundary; release-build runner; k_min probed in a separate untimed pass"
}