{
  "arm": "A_secure",
  "mode": "full-local",
  "family": "demo_family",
  "package_type": "demo_package",
  "workload_scale": 32,
  "n": 32,
  "R_hor": 32,
  "R_car": 32,
  "k_min": 10,
  "k_run": 13,
  "logical_lookup_cells": 0,
  "logical_mul_constraints": 145920,
  "logical_lin_constraints": 4672,
  "physical_rows": 928,
  "advice_cols": 167,
  "fixed_cols": 6,
  "instance_cols": 0,
  "synth_ms": 0.0024,
  "keygen_vk_ms": 390.1852,
  "keygen_pk_ms": 309.1689,
  "prove_ms": 11627.3851,
  "verify_ms": 43.8992,
  "peak_rss_mb": 208.54296875,
  "proof_bytes": 11072,
  "commit_hash": "b623acf315e3a2f2f8f588ed4b34be53c703d3dc",
  "rust_version": "rustc 1.89.0 (29483883e 2025-08-04)",
  "backend_commit": "b623acf315e3a2f2f8f588ed4b34be53c703d3dc",
  "machine_profile": "Windows-AMD64",
  "status": "full-local-ok",
  "notes": "A_secure full-local measured with real keygen/prove/verify (Blake2b transcript)"
}